<?xml version="1.0" encoding="UTF-8"?>
<xs:schema xmlns:xs="http://www.w3.org/2001/XMLSchema">
  <!-- Root element -->
  <xs:element name="pages">
    <xs:complexType>
      <xs:sequence>
        <xs:element name="page" type="pageType" maxOccurs="unbounded"/>
      </xs:sequence>
      <xs:attribute name="version" type="xs:string" use="required"/>
    </xs:complexType>
  </xs:element>

  <!-- Page type definition -->
  <xs:complexType name="pageType">
    <xs:sequence>
      <!-- Multi-view pages -->
      <xs:element name="view" type="viewType" minOccurs="0" maxOccurs="unbounded"/>
      <!-- External navigation buttons -->
      <xs:element name="button" type="buttonType" minOccurs="0" maxOccurs="unbounded"/>
    </xs:sequence>
    <xs:attribute name="id" type="xs:string" use="required"/>
    <xs:attribute name="url" type="xs:string" use="required"/>
    <xs:attribute name="title" type="xs:string"/>
    <xs:attribute name="defaultView" type="xs:string"/>
    <xs:attribute name="viewTransition" type="xs:string" default="fade"/>
  </xs:complexType>

  <!-- View type definition (for multi-view pages) -->
  <xs:complexType name="viewType">
    <xs:sequence>
      <xs:element name="button" type="buttonType" minOccurs="0" maxOccurs="unbounded"/>
    </xs:sequence>
    <xs:attribute name="id" type="xs:string" use="required"/>
    <xs:attribute name="name" type="xs:string" use="required"/>
    <xs:attribute name="title" type="xs:string"/>
  </xs:complexType>

  <!-- Button type definition -->
  <xs:complexType name="buttonType">
    <xs:sequence>
      <xs:element name="label" type="xs:string"/>
    </xs:sequence>
    <xs:attribute name="action" type="xs:string"/>
    <xs:attribute name="href" type="xs:string"/>
  </xs:complexType>
</xs:schema>
